{
  "$schemaVersion": 1,
  "generatedDocPath": "docs/omniverse-kit-companion-reference.g.md",
  "specStatus": "specification-only",
  "specStatusNote": "This file is the structured source for docs/omniverse-kit-companion.md and its generated reference appendix docs/omniverse-kit-companion-reference.g.md. It specifies a separately owned and separately distributed Omniverse Kit extension that no repository has implemented yet. Nothing here is evidence of an implementation, a publication, or an authorized Kit/Nucleus baseline: eng/omniverse-profile.json's kit-baseline dependency and the excluded-unreachable/kit-extension-companion-repo entry in eng/support-manifest.json are unchanged by this specification and remain the authoritative claims about what is and is not implemented.",
  "protocol": {
    "packageName": "openusd.bridge.v1",
    "serviceName": "openusd.bridge.v1.LiveBridge",
    "currentMajorVersion": 1,
    "currentMinorVersion": 0,
    "protoFiles": [
      "src/OpenUsd.Bridge.Protocol/protos/openusd/bridge/v1/wire.proto",
      "src/OpenUsd.Bridge.Protocol/protos/openusd/bridge/v1/service.proto"
    ],
    "maxUpdatesPerBatch": 4096,
    "maxCollectionElementCount": 65536,
    "maxTotalCollectionElementCountPerBatch": 4194304,
    "maxEstimatedBatchPayloadBytes": 16777216,
    "maxFrameOverheadBytes": 65536,
    "replayWindowDefaultLength": 64,
    "replayWindowMaxLength": 4096,
    "replayLedgerEntryBytes": 64
  },
  "kitBaseline": {
    "profileFile": "eng/omniverse-profile.json",
    "dependencyId": "kit-baseline",
    "note": "The extension.toml example's Kit baseline placeholder must resolve to this dependency's version field, not to a hardcoded number. eng/omniverse-profile.json currently declares it 'external-optional' with version 'pending' and versionSource null. It stays 'pending' until a named Kit release is independently authorized and pinned with its own repository-relative provenance file, at which point this note -- and only this note, never the placeholder text baked into an example -- is what changes."
  },
  "repositoryBoundary": {
    "thisRepository": {
      "owns": [
        "The openusd.bridge.v1 wire contract (wire.proto, service.proto) and its FileDescriptorSet",
        "The C# gRPC client adapter (OpenUsd.Bridge.Grpc) and the LiveAuthoringSessionCoordinator semantics it drives",
        "This specification, its machine-readable facts, and its checked pseudocode examples",
        "Protocol compatibility tests that a companion implementation can run against, once one exists"
      ],
      "license": "MIT (this repository's LICENSE)",
      "distribution": "NuGet.org: OpenUsd.Bridge.Protocol and OpenUsd.Bridge.Grpc, versioned with the rest of this repository's packages"
    },
    "companionExtension": {
      "owns": [
        "omni.client acquisition and omni:// URI resolution",
        "Nucleus authentication, SSO, and token handling",
        "Live session create/join/leave and .live layer I/O",
        "Kit stage notices and translating them into wire updates",
        "Every credential presented to Nucleus or to this protocol's own optional auth layer",
        "The server side of the openusd.bridge.v1 contract: Negotiate, GetSnapshot, GetStatus, PublishLocalBatch, StreamChanges"
      ],
      "repository": "A separate repository, not yet created or authorized. No path, name, or URL is reserved by this specification.",
      "license": "Chosen independently by that repository once authorized. This specification assumes no license for it and does not require MIT, Apache-2.0, or any other license this repository uses.",
      "distributionChannels": [
        "NGC (NVIDIA GPU Cloud) catalog listing, once published there",
        "Kit Extension Manager registry listing, once published there",
        "Local development via a Kit extension search path pointing at a working tree"
      ]
    },
    "boundaryStatement": "The wire contract is the only coupling point between the two repositories. This repository never depends on omni.client, Kit headers, or any NVIDIA-licensed source, and the companion extension never vendors this repository's source -- it depends on the published OpenUsd.Bridge.Protocol/OpenUsd.Bridge.Grpc packages (for a .NET-hosted companion) or generates Python stubs from the shipped .proto files (for a Kit-hosted companion), by version, like any other consumer. That separation is what keeps the two sides on independent release cadences and independent licenses, matching docs/omniverse-bridge.md's existing ownership table."
  },
  "extensionManifestDependencies": [
    { "id": "omni.kit.uiapp", "purpose": "GUI mode window, menu, and status-bar host for the companion's optional GUI extension", "versionConstraint": "pending" },
    { "id": "omni.usd", "purpose": "Kit-side stage access, stage notices, and .live layer authoring", "versionConstraint": "pending" },
    { "id": "omni.client", "purpose": "omni:// URI resolution and Nucleus connectivity", "versionConstraint": "pending" },
    { "id": "omni.kit.async_engine", "purpose": "Running the bidirectional gRPC stream loop on Kit's async event loop instead of blocking it", "versionConstraint": "pending" },
    { "id": "openusd-bridge-protocol-python-stubs", "purpose": "Generated Python protobuf/gRPC bindings produced from this repository's shipped .proto files at the companion's own build time; not a PyPI package this repository publishes", "versionConstraint": "pending" }
  ],
  "pythonGrpcWorkflow": {
    "steps": [
      "Obtain the exact .proto files from the OpenUsd.Bridge.Protocol package version the companion targets: src/OpenUsd.Bridge.Protocol/protos/openusd/bridge/v1/wire.proto and service.proto, or the equivalent FileDescriptorSet returned by OpenUsd.Bridge.Protocol.BridgeProtocol.CreateDescriptorSet() for a descriptor-driven toolchain that does not have file system access to the .proto sources.",
      "Generate stubs with grpcio-tools: python -m grpc_tools.protoc -I<protos-root> --python_out=<gen> --grpc_python_out=<gen> --pyi_out=<gen> openusd/bridge/v1/wire.proto openusd/bridge/v1/service.proto. Pin grpcio, grpcio-tools, and protobuf to versions compatible with the companion's own Kit Python runtime, not to whatever this repository's own tests happen to use.",
      "Never hand-edit generated _pb2.py/_pb2_grpc.py output. Regenerate it whenever the companion's pinned OpenUsd.Bridge.Protocol package version changes, and record which package version the checked-in (or build-time-generated) stubs were produced from.",
      "Verify the generated stub's package/version against the running server by reading openusd.bridge.v1.ProtocolVersion off the negotiated HandshakeResponse at connect time, never by trusting the generator invocation alone: a stale generated stub and a live server can disagree even when both files were technically regenerated.",
      "Package/version negotiation happens at the application layer (Negotiate), not at the gRPC/protobuf layer: a major-version mismatch is rejected by BridgeNegotiator-equivalent logic on both sides before any mutating call, and a newer minor version only adds capabilities.",
      "Configure the generated stub's channel with the same message-size, TLS, and keepalive options documented in maxMessageOptions and docs/omniverse-bridge.md's Security table so a Python server enforces the identical bounds the C# client already assumes."
    ],
    "packageNegotiation": "The companion never assumes its generated stub's package name or version matches the peer. It reads openusd.bridge.v1.PackageName ('openusd.bridge.v1') from the descriptor and openusd.bridge.v1.ProtocolVersion.{major,minor} from the negotiated HandshakeResponse, and refuses to proceed past Negotiate when the major version differs, exactly like the C# BridgeNegotiator.",
    "maxMessageOptions": {
      "grpcMaxSendMessageLength": "BridgeProtocol.MaxFrameBytes (MaxEstimatedBatchPayloadBytes + 65536), passed as grpc.max_send_message_length on both the Python server and any Python client",
      "grpcMaxReceiveMessageLength": "BridgeProtocol.MaxFrameBytes (MaxEstimatedBatchPayloadBytes + 65536), passed as grpc.max_receive_message_length; a frame at exactly the negotiated effective limit must still fit, so this bound is never set to the negotiated effective limit alone"
    }
  },
  "serverBehavior": [
    {
      "rpc": "Negotiate",
      "kind": "unary",
      "retrySafe": false,
      "preconditions": [
        "No prior successful Negotiate on this connection/session attempt"
      ],
      "steps": [
        "Reject immediately, with HANDSHAKE_REJECTION_UNAUTHENTICATED, when the presented credential (if any auth layer is configured) does not validate; never distinguish 'missing' from 'invalid' in the detail text",
        "Check request.client_version.major against the server's own major version; reject with HANDSHAKE_REJECTION_VERSION on any mismatch before evaluating capabilities or limits",
        "Compute agreed capabilities as the intersection of request.client_capabilities and the server's supported capabilities; reject with HANDSHAKE_REJECTION_CAPABILITY when CAPABILITY_FULL_SNAPSHOT or CAPABILITY_ORDERED_DELTA is missing from that intersection",
        "Compute effective_limits as the element-wise minimum of request.client_limits and the server's own enforced limits; reject with HANDSHAKE_REJECTION_LIMITS when any resulting bound is non-positive",
        "Verify request.bridge_root_path equals the one absolute prim path this server instance owns for the requesting Nucleus session/stage; reject with HANDSHAKE_REJECTION_BRIDGE_ROOT on any other value, including a sub-path or a parent path",